{
  "id": "lotte.privacy.S07.food_manufacturing.01",
  "docType": "privacy",
  "sectionId": "S07",
  "domainGroup": "food_manufacturing",
  "sourceCaptureIds": [
    "lotte-wellfood-privacy",
    "lotte-chilsung-privacy"
  ],
  "sourceSites": [
    "www.lottewellfood.com",
    "company.lottechilsung.co.kr"
  ],
  "policyVersionOrDate": "시행일자: 2026년 8월 10일 / 시행일자 : 2015년 03월 17일",
  "layout": "legacy_article",
  "text": "회사는 원칙적으로 이용자의 개인정보를 이 방침의 수집·이용 목적에서 알린 범위 내에서 사용하며, 이용자의 사전 동의 없이 그 범위를 초과하여 이용하거나 제3자에게 제공하지 않습니다. 다만 다음의 경우에는 예외로 합니다.\n- 이용자가 사전에 동의한 경우\n- 법령의 규정에 의하거나 수사 목적으로 법령에 정해진 절차와 방법에 따라 수사기관의 요구가 있는 경우\n{%if gate.thirdPartyProvision%}\n\n{{thirdPartyTable}}\n{%endif%}",
  "variables": [
    {
      "name": "thirdPartyTable",
      "slotId": "privacy.S07_thirdParties",
      "description": "Recipients with purpose, items, and recipient retention period"
    }
  ],
  "conditions": [
    {
      "slot": "gate.thirdPartyProvision",
      "op": "truthy"
    }
  ],
  "coversElements": [
    "R-S07-001",
    "R-S07-002",
    "R-S07-003"
  ],
  "gapsVsGuideline": [
    {
      "ruleId": "R-S07-005",
      "level": "may",
      "note": "조건부 유형화 미적용."
    }
  ],
  "vetted": false,
  "vettingNotes": "Not vetted. Awaiting privacy-domain-expert review against the current rule pack.",
  "frequency": 2,
  "frequencyBase": 2,
  "houseStyleTags": [],
  "provenance": [
    {
      "captureId": "lotte-wellfood-privacy",
      "sourceUrl": "https://www.lottewellfood.com/policy/privacy",
      "affiliate": "Lotte Wellfood",
      "businessGroup": "food_manufacturing",
      "captureDate": "2026-09-29",
      "policyVersionOrEffectiveDate": "시행일자: 2026년 8월 10일 ; v.2.22 ; v.2.21 ; v.2.20",
      "contentHash": "072b5887741bb5bb109ac2c6d576162ef430c18da9c328d1f8a3d22cd4d8aa94"
    },
    {
      "captureId": "lotte-chilsung-privacy",
      "sourceUrl": "https://company.lottechilsung.co.kr/kor/util/privacy/view.do?guide=14",
      "affiliate": "Lotte Chilsung Beverage",
      "businessGroup": "food_manufacturing",
      "captureDate": "2026-09-29",
      "policyVersionOrEffectiveDate": "시행일자 : 2015년 03월 17일 ; 시행일자 : 2026년 02월 12일 ; 시행일자 : 2025년 10월 22일 ; 시행일자 : 2025년 6월 30일",
      "contentHash": "649fa54564a02d4c3525dc1f9b85cd6f3147c2200781222bbcaa90abbb9e3ff8"
    }
  ]
}
