{
  "id": "lotte.privacy.S14.logistics.01",
  "docType": "privacy",
  "sectionId": "S14",
  "domainGroup": "logistics",
  "sourceCaptureIds": [
    "lotte-global-logis-privacy"
  ],
  "sourceSites": [
    "www.lotteglogis.com"
  ],
  "policyVersionOrDate": "v3.9",
  "layout": "guideline_numbered",
  "text": "7. 개인정보를 자동으로 수집하는 장치의 설치·운영 및 그 거부에 관한 사항\n1) 쿠키의 사용 목적\n- 회사는 이용자에게 맞춤 서비스를 제공하기 위해 쿠키를 사용합니다. 쿠키는 웹사이트 서버가 이용자의 브라우저에 보내는 작은 텍스트 파일이며 이용자의 기기에 저장됩니다.\n2) 쿠키의 허용 및 차단 설정\n- 이용자는 웹 브라우저의 설정 메뉴에서 쿠키 저장을 허용하거나 차단할 수 있습니다. 쿠키 저장을 차단하는 경우 로그인이 필요한 일부 서비스 이용에 어려움이 있을 수 있습니다.\n\n{{deviceTable}}",
  "variables": [
    {
      "name": "deviceTable",
      "slotId": "privacy.S14_devices",
      "description": "Automatic collection devices, purpose, refusal path"
    }
  ],
  "conditions": [
    {
      "slot": "gate.autoCollection",
      "op": "truthy"
    }
  ],
  "coversElements": [
    "R-S14-001",
    "R-S14-002"
  ],
  "gapsVsGuideline": [
    {
      "ruleId": "R-S14-003",
      "level": "must",
      "note": "행태정보 수집 여부 별도 고지 없음."
    }
  ],
  "vetted": false,
  "vettingNotes": "Not vetted. Awaiting privacy-domain-expert review against the current rule pack.",
  "frequency": 1,
  "frequencyBase": 1,
  "houseStyleTags": [
    "H-15"
  ],
  "provenance": [
    {
      "captureId": "lotte-global-logis-privacy",
      "sourceUrl": "https://www.lotteglogis.com/home/policy/privacy",
      "affiliate": "Lotte Global Logistics",
      "businessGroup": "logistics",
      "captureDate": "2026-09-29",
      "policyVersionOrEffectiveDate": "v3.9 ; v3.8 ; v3.7 ; v3.6",
      "contentHash": "410069f0b4dfeea3eac1b789a4a0b07900230a4fbfafecb6ae19f2c3f2fe8114"
    }
  ]
}
