{
  "id": "lotte.privacy.S11.cross_group.01",
  "docType": "privacy",
  "sectionId": "S11",
  "domainGroup": "cross_group",
  "sourceCaptureIds": [
    "lotte-holdings-privacy",
    "lotte-recruit-privacy",
    "lotte-department-store-privacy",
    "lotte-mart-privacy",
    "seven-eleven-privacy",
    "lotte-himart-privacy",
    "lotte-himart-mall-privacy",
    "lotte-rental-privacy",
    "lotte-castle-privacy",
    "lotte-global-logis-privacy",
    "lotte-chilsung-privacy",
    "lpoint-privacy",
    "lotte-members-privacy"
  ],
  "sourceSites": [
    "www.lotte.co.kr",
    "recruit.lotte.co.kr",
    "www.lotteshopping.com",
    "company.lottemart.com",
    "www.7-eleven.co.kr",
    "company.himart.co.kr",
    "www.e-himart.co.kr",
    "www.lotterentacar.net",
    "www.lottecastle.co.kr",
    "www.lotteglogis.com",
    "company.lottechilsung.co.kr",
    "m.lpoint.com",
    "www.lottemembers.com"
  ],
  "policyVersionOrDate": "공고일자 : 2026년 03월 10일 / 2026. 09. 08부터 적용 / 2026년 07월 22일부터 적용 / 시행일자 : 2026-07-09",
  "layout": "guideline_numbered",
  "text": "회사는 개인정보의 안전성 확보를 위해 다음과 같은 조치를 하고 있습니다.\n\n가. 관리적 조치\n- 내부관리계획 수립·시행, 개인정보 취급 직원의 지정 및 최소화, 정기적인 직원 교육\n나. 기술적 조치\n- 개인정보처리시스템 등의 접근권한 관리, 접근통제시스템 설치, 고유식별정보 등의 암호화, 보안프로그램 설치 및 주기적 갱신·점검, 접속 기록의 보관 및 위·변조 방지\n다. 물리적 조치\n- 전산실, 자료 보관실 등의 접근통제\n\n{{securityMeasures}}",
  "variables": [
    {
      "name": "securityMeasures",
      "slotId": "privacy.S11_measures",
      "description": "Managerial, technical and physical safeguards actually implemented"
    }
  ],
  "conditions": [],
  "coversElements": [
    "R-S11-001",
    "R-S11-002"
  ],
  "gapsVsGuideline": [
    {
      "ruleId": "R-S11-003",
      "level": "may",
      "note": "보안 위험을 알리는 표현('해킹 방지 완벽') 여부는 슬롯 값 점검 필요."
    }
  ],
  "vetted": false,
  "vettingNotes": "「개인정보의 안전성 확보조치 기준」(고시)의 현행 조항과 대조 필요.",
  "frequency": 13,
  "frequencyBase": 15,
  "houseStyleTags": [
    "H-02"
  ],
  "provenance": [
    {
      "captureId": "lotte-holdings-privacy",
      "sourceUrl": "https://www.lotte.co.kr/privacy/agree.do",
      "affiliate": "Lotte Holdings (group corporate site)",
      "businessGroup": "group_holding",
      "captureDate": "2026-09-29",
      "policyVersionOrEffectiveDate": "공고일자 : 2026년 03월 10일 ; 시행일자 : 2026년 03월 16일 ; 2026년 03월 16일 부터 시행",
      "contentHash": "1ad4f5da933e8cf4870d164c407d8058be09b3e60dc19fabceed3379cef6aa87"
    },
    {
      "captureId": "lotte-recruit-privacy",
      "sourceUrl": "https://recruit.lotte.co.kr/about/personalPolicy27",
      "affiliate": "Lotte Group recruiting site",
      "businessGroup": "hr_corporate",
      "captureDate": "2026-09-29",
      "policyVersionOrEffectiveDate": "2026. 09. 08부터 적용 ; ver 9.1 ; ver 9.0 ; ver 8.9",
      "contentHash": "bea4c6ae916cd20a0fe393a2c59f45a88fcf71f0485597054be67d5bc3354c48"
    },
    {
      "captureId": "lotte-department-store-privacy",
      "sourceUrl": "https://www.lotteshopping.com/etc/personalinfo",
      "affiliate": "Lotte Department Store",
      "businessGroup": "retail_ecommerce",
      "captureDate": "2026-09-29",
      "policyVersionOrEffectiveDate": "2026년 07월 22일부터 적용 ; v19.9 ; V19.8 ; V19.9",
      "contentHash": "a859427af048dabf825212295551607baaa748b71da215390d0194ffcf34fbb0"
    },
    {
      "captureId": "lotte-mart-privacy",
      "sourceUrl": "https://company.lottemart.com/privacy/privacy.asp",
      "affiliate": "Lotte Mart",
      "businessGroup": "retail_ecommerce",
      "captureDate": "2026-09-29",
      "policyVersionOrEffectiveDate": "시행일자 : 2026-07-09 ; 2026년 7월 9일부터 적용 ; V13.5 ; V13.4",
      "contentHash": "590a26db8498b8c4c8e6207f1d0ae882474ee75a92941b51e9a6ef52435f4d4d"
    },
    {
      "captureId": "seven-eleven-privacy",
      "sourceUrl": "https://www.7-eleven.co.kr/util/policyPrivacy.asp",
      "affiliate": "Korea Seven (7-Eleven)",
      "businessGroup": "retail_ecommerce",
      "captureDate": "2026-09-29",
      "policyVersionOrEffectiveDate": "공고일자 : 2010년 12월 03일 ; 개정일자 : 2026년 07월 08일 ; 시행일자 : 2026년 07월 15일 ; 2026년 07월 15일 시행",
      "contentHash": "6af655aff980d52c4d64c8ebea85ef5d24994e94e40fdd6bd45bb3ee912cd2f0"
    },
    {
      "captureId": "lotte-himart-privacy",
      "sourceUrl": "https://company.himart.co.kr/policy/privacy",
      "affiliate": "Lotte Himart",
      "businessGroup": "retail_ecommerce",
      "captureDate": "2026-09-29",
      "policyVersionOrEffectiveDate": "2026.03.30부터 적용",
      "contentHash": "83b3b5e65b8d770cc4afbb51379c4a472ed07128a7c60d2bdb141a316d91a5cf"
    },
    {
      "captureId": "lotte-himart-mall-privacy",
      "sourceUrl": "https://www.e-himart.co.kr/app/terms/privacy?stonType=PC",
      "affiliate": "Lotte Himart",
      "businessGroup": "retail_ecommerce",
      "captureDate": "2026-09-29",
      "policyVersionOrEffectiveDate": "2026.07.10부터 적용 ; VER 9.6 ; VER 9.5 ; VER 9.4",
      "contentHash": "df3adf5a2e5bbb423c88ecf061c24e22d7647dc3a22eb6a5e468e6ad54c2b3b7"
    },
    {
      "captureId": "lotte-rental-privacy",
      "sourceUrl": "https://www.lotterentacar.net/kor/footer/footerPolicyNew.do?mnCd=FN0901",
      "affiliate": "Lotte Rental",
      "businessGroup": "services_leisure",
      "captureDate": "2026-09-29",
      "policyVersionOrEffectiveDate": "개정일자 : 2020/09/25 ; 시행일자 : 2020/12/03 ; 공고일자 : 2020년 11월 26일 ; 시행일자 : 2020년 12월 3일",
      "contentHash": "2b508985e7e91f23cd36385ed033257a8a1eaad82396f7d75f2aa981c5ee8ba7"
    },
    {
      "captureId": "lotte-castle-privacy",
      "sourceUrl": "https://www.lottecastle.co.kr/privacy/index.do",
      "affiliate": "Lotte E&C (Lotte Castle brand)",
      "businessGroup": "construction_realestate",
      "captureDate": "2026-09-29",
      "policyVersionOrEffectiveDate": "시행일자 : 2026년 07월 16일 ; 공고일자 : 2026년 07월 09일 ; 2026년 07월 16일 시행 ; 2026년 05월 13일 시행",
      "contentHash": "d346946e83f4c4b1d279675daad519db2fef800cd78ba1dc456630f88daa2bde"
    },
    {
      "captureId": "lotte-global-logis-privacy",
      "sourceUrl": "https://www.lotteglogis.com/home/policy/privacy",
      "affiliate": "Lotte Global Logistics",
      "businessGroup": "logistics",
      "captureDate": "2026-09-29",
      "policyVersionOrEffectiveDate": "v3.9 ; v3.8 ; v3.7 ; v3.6",
      "contentHash": "410069f0b4dfeea3eac1b789a4a0b07900230a4fbfafecb6ae19f2c3f2fe8114"
    },
    {
      "captureId": "lotte-chilsung-privacy",
      "sourceUrl": "https://company.lottechilsung.co.kr/kor/util/privacy/view.do?guide=14",
      "affiliate": "Lotte Chilsung Beverage",
      "businessGroup": "food_manufacturing",
      "captureDate": "2026-09-29",
      "policyVersionOrEffectiveDate": "시행일자 : 2015년 03월 17일 ; 시행일자 : 2026년 02월 12일 ; 시행일자 : 2025년 10월 22일 ; 시행일자 : 2025년 6월 30일",
      "contentHash": "649fa54564a02d4c3525dc1f9b85cd6f3147c2200781222bbcaa90abbb9e3ff8"
    },
    {
      "captureId": "lpoint-privacy",
      "sourceUrl": "https://m.lpoint.com/app/center/LWDD100300.do?prvGrpId=A07&prvSeq=275",
      "affiliate": "Lotte Members (L.POINT)",
      "businessGroup": "loyalty_membership",
      "captureDate": "2026-09-29",
      "policyVersionOrEffectiveDate": "시행일자 : 2016. 7. 1 ; 시행일자 : 2016. 7. 11 ; 시행일자 : 2016. 7. 27 ; 시행일자 : 2016. 8. 16",
      "contentHash": "a3869dc06869e39c3abf2222dfe62b26930acf7f5f4cbc576c3a8b7f6382a962"
    },
    {
      "captureId": "lotte-members-privacy",
      "sourceUrl": "https://www.lottemembers.com/",
      "affiliate": "Lotte Members (corporate site)",
      "businessGroup": "loyalty_membership",
      "captureDate": "2026-09-29",
      "policyVersionOrEffectiveDate": "v1.0",
      "contentHash": "1862444f2c11a5500330fd73df432d33c80f027e0ca522c198d11c90cbdb41b4"
    }
  ]
}
