{
  "id": "lotte.terms.T15.cross_group.01",
  "docType": "terms",
  "sectionId": "T15",
  "domainGroup": "cross_group",
  "sourceCaptureIds": [
    "lotte-mart-terms",
    "lotte-himart-terms",
    "lotte-rental-terms",
    "lotte-global-logis-terms-parcel-service",
    "lotte-global-logis-terms-location",
    "lotte-chilsung-terms",
    "lpoint-terms-members-portal",
    "lpoint-terms"
  ],
  "sourceSites": [
    "company.lottemart.com",
    "company.himart.co.kr",
    "www.lotterentacar.net",
    "www.lotteglogis.com",
    "company.lottechilsung.co.kr",
    "members.lpoint.com"
  ],
  "policyVersionOrDate": "2025년 10월 1일부터 적용 / 2025.08.29부터 적용 / 시행일자 : 2020/01/16 / 시행일 : 2020년 6월 5일",
  "layout": "legacy_article",
  "text": "제N조 (분쟁해결)\n1. 회사는 이용자가 제기하는 정당한 의견이나 불만을 반영하고 그 피해를 보상처리하기 위하여 피해보상처리기구를 설치·운영합니다.\n2. 회사는 이용자로부터 제출되는 불만사항 및 의견은 우선적으로 그 사항을 처리합니다. 다만 신속한 처리가 곤란한 경우에는 이용자에게 그 사유와 처리일정을 즉시 통보합니다.\n3. 회사와 이용자 간에 발생한 전자상거래 분쟁과 관련하여 이용자의 피해구제신청이 있는 경우에는 공정거래위원회 또는 시·도지사가 의뢰하는 분쟁조정기관의 조정에 따를 수 있습니다.",
  "variables": [],
  "conditions": [
    {
      "slot": "terms.applicable",
      "op": "truthy"
    }
  ],
  "coversElements": [
    "R-T15-001",
    "R-T15-002"
  ],
  "gapsVsGuideline": [
    {
      "ruleId": "R-T15-005",
      "level": "must",
      "note": "소송 제기 금지·입증책임 전가 조항이 섞여 있지 않은지 vetting 필요."
    }
  ],
  "vetted": false,
  "vettingNotes": "Not vetted. Awaiting privacy-domain-expert review against the current rule pack.",
  "frequency": 8,
  "frequencyBase": 13,
  "houseStyleTags": [],
  "provenance": [
    {
      "captureId": "lotte-mart-terms",
      "sourceUrl": "https://company.lottemart.com/privacy/term.asp",
      "affiliate": "Lotte Mart",
      "businessGroup": "retail_ecommerce",
      "captureDate": "2026-09-29",
      "policyVersionOrEffectiveDate": "2025년 10월 1일부터 적용 ; 2025년 5월 29일부터 적용",
      "contentHash": "5ac1c0c774222ff77be14ea0dff78529b128683e67b2095cb40543a80246eaed"
    },
    {
      "captureId": "lotte-himart-terms",
      "sourceUrl": "https://company.himart.co.kr/policy/terms",
      "affiliate": "Lotte Himart",
      "businessGroup": "retail_ecommerce",
      "captureDate": "2026-09-29",
      "policyVersionOrEffectiveDate": "2025.08.29부터 적용",
      "contentHash": "59e7cc599d744e3fda2d9afad802786922cbd67b51afa876bf2f615a625db01f"
    },
    {
      "captureId": "lotte-rental-terms",
      "sourceUrl": "https://www.lotterentacar.net/kor/footer/footerTermsNew.do?mnCd=MK0903",
      "affiliate": "Lotte Rental",
      "businessGroup": "services_leisure",
      "captureDate": "2026-09-29",
      "policyVersionOrEffectiveDate": "시행일자 : 2020/01/16 ; 2020년 1월 16일부터 시행",
      "contentHash": "53373e281b85b33a258cd270a4541695a574adb432e972f917c03c87daee5600"
    },
    {
      "captureId": "lotte-global-logis-terms-parcel-service",
      "sourceUrl": "https://www.lotteglogis.com/home/policy/service",
      "affiliate": "Lotte Global Logistics",
      "businessGroup": "logistics",
      "captureDate": "2026-09-29",
      "policyVersionOrEffectiveDate": "시행일 : 2020년 6월 5일",
      "contentHash": "b1e9b3279664b85623f0ced70947b59042fec99889200a4f94cd9666f7981024"
    },
    {
      "captureId": "lotte-global-logis-terms-location",
      "sourceUrl": "https://www.lotteglogis.com/home/policy/location",
      "affiliate": "Lotte Global Logistics",
      "businessGroup": "logistics",
      "captureDate": "2026-09-29",
      "policyVersionOrEffectiveDate": "2016년 5월 3일부터 시행",
      "contentHash": "77d5485dba1c140585cc1891356957c01900b3dd86b8ed5769c2607be14c214d"
    },
    {
      "captureId": "lotte-chilsung-terms",
      "sourceUrl": "https://company.lottechilsung.co.kr/kor/util/terms/contentsid/567/index.do",
      "affiliate": "Lotte Chilsung Beverage",
      "businessGroup": "food_manufacturing",
      "captureDate": "2026-09-29",
      "policyVersionOrEffectiveDate": "2015년 04월 20일부터 시행",
      "contentHash": "0042aa51bf8696d3c2ea0c3ddc8949134723a7521527e2810c3adafab69f4408"
    },
    {
      "captureId": "lpoint-terms-members-portal",
      "sourceUrl": "https://members.lpoint.com/resources/html/privacy/iframe_1000_C1_ko.html",
      "affiliate": "Lotte Members (L.POINT)",
      "businessGroup": "loyalty_membership",
      "captureDate": "2026-09-29",
      "policyVersionOrEffectiveDate": "2020년 04월 28일부터 시행 ; 2020.04.28 개정 ; 2020년 08월 18일부터 시행 ; 2020년 11월 19일부터 시행",
      "contentHash": "82d05f33b2100a3b70b65012ece5ed78b41c3041579ee075b8fc9f93d634ece8"
    },
    {
      "captureId": "lpoint-terms",
      "sourceUrl": "https://members.lpoint.com/resources/html/privacy/iframe_1009_C0_ko.html",
      "affiliate": "Lotte Members (L.POINT)",
      "businessGroup": "loyalty_membership",
      "captureDate": "2026-09-29",
      "policyVersionOrEffectiveDate": "2012년 2월 22일부터 시행 ; 2012년 2월 22일 개정 ; 2013년 5월 1일부터 시행 ; 2013년 5월 1일 개정",
      "contentHash": "11203ef1de8f0d33430f958a1facaa7ae39be78bd5a0d86c8ad2abaf952021bb"
    }
  ]
}
