{
  "id": "lotte.privacy.S01.construction_realestate.01",
  "docType": "privacy",
  "sectionId": "S01",
  "domainGroup": "construction_realestate",
  "sourceCaptureIds": [
    "lotte-castle-privacy"
  ],
  "sourceSites": [
    "www.lottecastle.co.kr"
  ],
  "policyVersionOrDate": "시행일자 : 2026년 07월 16일",
  "layout": "legacy_article",
  "text": "\"개인정보\"란 살아 있는 개인에 관한 정보로서 성명, 영상 등을 통하여 개인을 알아볼 수 있는 정보(해당 정보만으로는 특정 개인을 알아볼 수 없더라도 다른 정보와 쉽게 결합하여 알아볼 수 있는 것을 포함합니다)를 말합니다.\n\n{{operatorName}}(이하 \"회사\")는 이용자의 개인정보를 중요하게 생각하며 「개인정보 보호법」을 준수합니다. 회사는 개인정보 처리방침을 {{serviceName}} 첫 화면에 공개하고, 변경되는 경우 변경 이유와 내용을 {{noticeMethod}}로 알려드립니다.",
  "variables": [
    {
      "name": "operatorName",
      "slotId": "profile.orgNameRef",
      "description": "Operator legal name (defined once as 회사)"
    },
    {
      "name": "serviceName",
      "slotId": "profile.serviceNames",
      "description": "Service or site name(s) covered by the document"
    },
    {
      "name": "noticeMethod",
      "slotId": "privacy.S24_noticeMethod",
      "description": "Where and how change notices are given"
    }
  ],
  "conditions": [],
  "coversElements": [
    "R-S01-003",
    "R-S01-004"
  ],
  "gapsVsGuideline": [],
  "vetted": false,
  "vettingNotes": "개인정보 정의 문단을 서문에 두는 건설·부동산 패턴. 정의 문구는 법령 정의와 대조 필요.",
  "frequency": 1,
  "frequencyBase": 1,
  "houseStyleTags": [],
  "provenance": [
    {
      "captureId": "lotte-castle-privacy",
      "sourceUrl": "https://www.lottecastle.co.kr/privacy/index.do",
      "affiliate": "Lotte E&C (Lotte Castle brand)",
      "businessGroup": "construction_realestate",
      "captureDate": "2026-09-29",
      "policyVersionOrEffectiveDate": "시행일자 : 2026년 07월 16일 ; 공고일자 : 2026년 07월 09일 ; 2026년 07월 16일 시행 ; 2026년 05월 13일 시행",
      "contentHash": "d346946e83f4c4b1d279675daad519db2fef800cd78ba1dc456630f88daa2bde"
    }
  ]
}
