{
  "id": "lotte.privacy.S07.cross_group.01",
  "docType": "privacy",
  "sectionId": "S07",
  "domainGroup": "cross_group",
  "sourceCaptureIds": [
    "lotte-holdings-privacy",
    "lotte-recruit-privacy",
    "lotte-department-store-privacy",
    "lotte-mart-privacy",
    "seven-eleven-privacy",
    "lotte-himart-privacy",
    "lotte-himart-mall-privacy",
    "lotte-rental-privacy",
    "lotte-global-logis-privacy",
    "lotte-wellfood-privacy",
    "lpoint-privacy",
    "lotte-members-privacy"
  ],
  "sourceSites": [
    "www.lotte.co.kr",
    "recruit.lotte.co.kr",
    "www.lotteshopping.com",
    "company.lottemart.com",
    "www.7-eleven.co.kr",
    "company.himart.co.kr",
    "www.e-himart.co.kr",
    "www.lotterentacar.net",
    "www.lotteglogis.com",
    "www.lottewellfood.com",
    "m.lpoint.com",
    "www.lottemembers.com"
  ],
  "policyVersionOrDate": "공고일자 : 2026년 03월 10일 / 2026. 09. 08부터 적용 / 2026년 07월 22일부터 적용 / 시행일자 : 2026-07-09",
  "layout": "guideline_numbered",
  "text": "회사는 정보주체의 개인정보를 개인정보의 처리 목적에서 명시한 범위 내에서만 처리하며, 정보주체의 동의가 있거나 관련 법령에 특별한 규정이 있는 경우를 제외하고는 개인정보를 제3자에게 제공하지 않습니다.\n{%if gate.thirdPartyProvision%}\n회사는 원활한 서비스 제공을 위하여 다음의 경우 정보주체의 동의를 얻어 필요한 최소한의 범위로만 제공합니다.\n\n{{thirdPartyTable}}\n\n(표 열) 제공받는 자 / 제공 목적 / 제공 항목 / 제공받는 자의 보유 및 이용기간\n{%endif%}\n{%if not gate.thirdPartyProvision%}\n회사는 개인정보를 제3자에게 제공하지 않습니다.\n{%endif%}",
  "variables": [
    {
      "name": "thirdPartyTable",
      "slotId": "privacy.S07_thirdParties",
      "description": "Recipients with purpose, items, and recipient retention period"
    }
  ],
  "conditions": [],
  "coversElements": [
    "R-S07-001",
    "R-S07-002",
    "R-S07-003"
  ],
  "gapsVsGuideline": [
    {
      "ruleId": "R-S07-005",
      "level": "may",
      "note": "2026.4 조건부 유형화(마이페이지 등에서 실제 수령자 확인) 방식은 원문에 없음."
    },
    {
      "ruleId": "R-S07-006",
      "level": "may",
      "note": "국외 제공 안내는 S10 연계 문장 필요."
    }
  ],
  "vetted": false,
  "vettingNotes": "Not vetted. Awaiting privacy-domain-expert review against the current rule pack.",
  "frequency": 12,
  "frequencyBase": 15,
  "houseStyleTags": [],
  "provenance": [
    {
      "captureId": "lotte-holdings-privacy",
      "sourceUrl": "https://www.lotte.co.kr/privacy/agree.do",
      "affiliate": "Lotte Holdings (group corporate site)",
      "businessGroup": "group_holding",
      "captureDate": "2026-09-29",
      "policyVersionOrEffectiveDate": "공고일자 : 2026년 03월 10일 ; 시행일자 : 2026년 03월 16일 ; 2026년 03월 16일 부터 시행",
      "contentHash": "1ad4f5da933e8cf4870d164c407d8058be09b3e60dc19fabceed3379cef6aa87"
    },
    {
      "captureId": "lotte-recruit-privacy",
      "sourceUrl": "https://recruit.lotte.co.kr/about/personalPolicy27",
      "affiliate": "Lotte Group recruiting site",
      "businessGroup": "hr_corporate",
      "captureDate": "2026-09-29",
      "policyVersionOrEffectiveDate": "2026. 09. 08부터 적용 ; ver 9.1 ; ver 9.0 ; ver 8.9",
      "contentHash": "bea4c6ae916cd20a0fe393a2c59f45a88fcf71f0485597054be67d5bc3354c48"
    },
    {
      "captureId": "lotte-department-store-privacy",
      "sourceUrl": "https://www.lotteshopping.com/etc/personalinfo",
      "affiliate": "Lotte Department Store",
      "businessGroup": "retail_ecommerce",
      "captureDate": "2026-09-29",
      "policyVersionOrEffectiveDate": "2026년 07월 22일부터 적용 ; v19.9 ; V19.8 ; V19.9",
      "contentHash": "a859427af048dabf825212295551607baaa748b71da215390d0194ffcf34fbb0"
    },
    {
      "captureId": "lotte-mart-privacy",
      "sourceUrl": "https://company.lottemart.com/privacy/privacy.asp",
      "affiliate": "Lotte Mart",
      "businessGroup": "retail_ecommerce",
      "captureDate": "2026-09-29",
      "policyVersionOrEffectiveDate": "시행일자 : 2026-07-09 ; 2026년 7월 9일부터 적용 ; V13.5 ; V13.4",
      "contentHash": "590a26db8498b8c4c8e6207f1d0ae882474ee75a92941b51e9a6ef52435f4d4d"
    },
    {
      "captureId": "seven-eleven-privacy",
      "sourceUrl": "https://www.7-eleven.co.kr/util/policyPrivacy.asp",
      "affiliate": "Korea Seven (7-Eleven)",
      "businessGroup": "retail_ecommerce",
      "captureDate": "2026-09-29",
      "policyVersionOrEffectiveDate": "공고일자 : 2010년 12월 03일 ; 개정일자 : 2026년 07월 08일 ; 시행일자 : 2026년 07월 15일 ; 2026년 07월 15일 시행",
      "contentHash": "6af655aff980d52c4d64c8ebea85ef5d24994e94e40fdd6bd45bb3ee912cd2f0"
    },
    {
      "captureId": "lotte-himart-privacy",
      "sourceUrl": "https://company.himart.co.kr/policy/privacy",
      "affiliate": "Lotte Himart",
      "businessGroup": "retail_ecommerce",
      "captureDate": "2026-09-29",
      "policyVersionOrEffectiveDate": "2026.03.30부터 적용",
      "contentHash": "83b3b5e65b8d770cc4afbb51379c4a472ed07128a7c60d2bdb141a316d91a5cf"
    },
    {
      "captureId": "lotte-himart-mall-privacy",
      "sourceUrl": "https://www.e-himart.co.kr/app/terms/privacy?stonType=PC",
      "affiliate": "Lotte Himart",
      "businessGroup": "retail_ecommerce",
      "captureDate": "2026-09-29",
      "policyVersionOrEffectiveDate": "2026.07.10부터 적용 ; VER 9.6 ; VER 9.5 ; VER 9.4",
      "contentHash": "df3adf5a2e5bbb423c88ecf061c24e22d7647dc3a22eb6a5e468e6ad54c2b3b7"
    },
    {
      "captureId": "lotte-rental-privacy",
      "sourceUrl": "https://www.lotterentacar.net/kor/footer/footerPolicyNew.do?mnCd=FN0901",
      "affiliate": "Lotte Rental",
      "businessGroup": "services_leisure",
      "captureDate": "2026-09-29",
      "policyVersionOrEffectiveDate": "개정일자 : 2020/09/25 ; 시행일자 : 2020/12/03 ; 공고일자 : 2020년 11월 26일 ; 시행일자 : 2020년 12월 3일",
      "contentHash": "2b508985e7e91f23cd36385ed033257a8a1eaad82396f7d75f2aa981c5ee8ba7"
    },
    {
      "captureId": "lotte-global-logis-privacy",
      "sourceUrl": "https://www.lotteglogis.com/home/policy/privacy",
      "affiliate": "Lotte Global Logistics",
      "businessGroup": "logistics",
      "captureDate": "2026-09-29",
      "policyVersionOrEffectiveDate": "v3.9 ; v3.8 ; v3.7 ; v3.6",
      "contentHash": "410069f0b4dfeea3eac1b789a4a0b07900230a4fbfafecb6ae19f2c3f2fe8114"
    },
    {
      "captureId": "lotte-wellfood-privacy",
      "sourceUrl": "https://www.lottewellfood.com/policy/privacy",
      "affiliate": "Lotte Wellfood",
      "businessGroup": "food_manufacturing",
      "captureDate": "2026-09-29",
      "policyVersionOrEffectiveDate": "시행일자: 2026년 8월 10일 ; v.2.22 ; v.2.21 ; v.2.20",
      "contentHash": "072b5887741bb5bb109ac2c6d576162ef430c18da9c328d1f8a3d22cd4d8aa94"
    },
    {
      "captureId": "lpoint-privacy",
      "sourceUrl": "https://m.lpoint.com/app/center/LWDD100300.do?prvGrpId=A07&prvSeq=275",
      "affiliate": "Lotte Members (L.POINT)",
      "businessGroup": "loyalty_membership",
      "captureDate": "2026-09-29",
      "policyVersionOrEffectiveDate": "시행일자 : 2016. 7. 1 ; 시행일자 : 2016. 7. 11 ; 시행일자 : 2016. 7. 27 ; 시행일자 : 2016. 8. 16",
      "contentHash": "a3869dc06869e39c3abf2222dfe62b26930acf7f5f4cbc576c3a8b7f6382a962"
    },
    {
      "captureId": "lotte-members-privacy",
      "sourceUrl": "https://www.lottemembers.com/",
      "affiliate": "Lotte Members (corporate site)",
      "businessGroup": "loyalty_membership",
      "captureDate": "2026-09-29",
      "policyVersionOrEffectiveDate": "v1.0",
      "contentHash": "1862444f2c11a5500330fd73df432d33c80f027e0ca522c198d11c90cbdb41b4"
    }
  ]
}
