{
  "id": "lotte.privacy.S24.hr_corporate.01",
  "docType": "privacy",
  "sectionId": "S24",
  "domainGroup": "hr_corporate",
  "sourceCaptureIds": [
    "lotte-recruit-privacy"
  ],
  "sourceSites": [
    "recruit.lotte.co.kr"
  ],
  "policyVersionOrDate": "2026. 09. 08부터 적용",
  "layout": "legacy_article",
  "text": "개인정보 처리방침 버전 목록\n{{priorVersions}}\n(표 열) 버전 / 변경일자 / 적용 기간\n\n회사는 개인정보 처리방침을 개정하는 경우 버전번호와 개정일자를 부여하고, 이전 버전을 언제든지 확인할 수 있도록 유지합니다.",
  "variables": [
    {
      "name": "priorVersions",
      "slotId": "privacy.S24_priorVersions",
      "description": "Prior versions with application periods"
    }
  ],
  "conditions": [],
  "coversElements": [
    "R-S24-002",
    "R-S24-003"
  ],
  "gapsVsGuideline": [
    {
      "ruleId": "R-S24-004",
      "level": "must",
      "note": "신·구 대조표는 없음."
    },
    {
      "ruleId": "R-S24-001",
      "level": "must",
      "note": "'적용 기간'의 종료일 표기는 없고 변경일자만 표시."
    }
  ],
  "vetted": false,
  "vettingNotes": "Not vetted. Awaiting privacy-domain-expert review against the current rule pack.",
  "frequency": 1,
  "frequencyBase": 1,
  "houseStyleTags": [
    "H-10"
  ],
  "provenance": [
    {
      "captureId": "lotte-recruit-privacy",
      "sourceUrl": "https://recruit.lotte.co.kr/about/personalPolicy27",
      "affiliate": "Lotte Group recruiting site",
      "businessGroup": "hr_corporate",
      "captureDate": "2026-09-29",
      "policyVersionOrEffectiveDate": "2026. 09. 08부터 적용 ; ver 9.1 ; ver 9.0 ; ver 8.9",
      "contentHash": "bea4c6ae916cd20a0fe393a2c59f45a88fcf71f0485597054be67d5bc3354c48"
    }
  ]
}
