{
  "id": "lotte.terms.T08.cross_group.01",
  "docType": "terms",
  "sectionId": "T08",
  "domainGroup": "cross_group",
  "sourceCaptureIds": [
    "lotte-mart-terms",
    "lotte-himart-terms",
    "lotte-rental-terms",
    "lotte-chilsung-terms",
    "lpoint-terms"
  ],
  "sourceSites": [
    "company.lottemart.com",
    "company.himart.co.kr",
    "www.lotterentacar.net",
    "company.lottechilsung.co.kr",
    "members.lpoint.com"
  ],
  "policyVersionOrDate": "2025년 10월 1일부터 적용 / 2025.08.29부터 적용 / 시행일자 : 2020/01/16 / 2015년 04월 20일부터 시행",
  "layout": "legacy_article",
  "text": "제8조 (회원에 대한 통지)\n1. 회사가 회원에 대한 통지를 하는 경우, 회원이 회사와 미리 약정하여 지정한 {{memberNoticeChannels}}로 할 수 있습니다.\n2. 회사는 불특정다수 회원에 대한 통지의 경우 1주일 이상 서비스의 게시판에 게시함으로써 개별 통지에 갈음할 수 있습니다. 다만 회원 본인의 거래와 관련하여 중대한 영향을 미치는 사항에 대하여는 개별 통지를 합니다.",
  "variables": [
    {
      "name": "memberNoticeChannels",
      "slotId": "terms.memberNoticeChannels",
      "description": "Channels for individual notices to members"
    }
  ],
  "conditions": [
    {
      "all": [
        {
          "slot": "terms.applicable",
          "op": "truthy"
        },
        {
          "slot": "gate.membership",
          "op": "truthy"
        }
      ]
    }
  ],
  "coversElements": [
    "R-T08-001",
    "R-T08-002"
  ],
  "gapsVsGuideline": [],
  "vetted": false,
  "vettingNotes": "Not vetted. Awaiting privacy-domain-expert review against the current rule pack.",
  "frequency": 5,
  "frequencyBase": 13,
  "houseStyleTags": [],
  "provenance": [
    {
      "captureId": "lotte-mart-terms",
      "sourceUrl": "https://company.lottemart.com/privacy/term.asp",
      "affiliate": "Lotte Mart",
      "businessGroup": "retail_ecommerce",
      "captureDate": "2026-09-29",
      "policyVersionOrEffectiveDate": "2025년 10월 1일부터 적용 ; 2025년 5월 29일부터 적용",
      "contentHash": "5ac1c0c774222ff77be14ea0dff78529b128683e67b2095cb40543a80246eaed"
    },
    {
      "captureId": "lotte-himart-terms",
      "sourceUrl": "https://company.himart.co.kr/policy/terms",
      "affiliate": "Lotte Himart",
      "businessGroup": "retail_ecommerce",
      "captureDate": "2026-09-29",
      "policyVersionOrEffectiveDate": "2025.08.29부터 적용",
      "contentHash": "59e7cc599d744e3fda2d9afad802786922cbd67b51afa876bf2f615a625db01f"
    },
    {
      "captureId": "lotte-rental-terms",
      "sourceUrl": "https://www.lotterentacar.net/kor/footer/footerTermsNew.do?mnCd=MK0903",
      "affiliate": "Lotte Rental",
      "businessGroup": "services_leisure",
      "captureDate": "2026-09-29",
      "policyVersionOrEffectiveDate": "시행일자 : 2020/01/16 ; 2020년 1월 16일부터 시행",
      "contentHash": "53373e281b85b33a258cd270a4541695a574adb432e972f917c03c87daee5600"
    },
    {
      "captureId": "lotte-chilsung-terms",
      "sourceUrl": "https://company.lottechilsung.co.kr/kor/util/terms/contentsid/567/index.do",
      "affiliate": "Lotte Chilsung Beverage",
      "businessGroup": "food_manufacturing",
      "captureDate": "2026-09-29",
      "policyVersionOrEffectiveDate": "2015년 04월 20일부터 시행",
      "contentHash": "0042aa51bf8696d3c2ea0c3ddc8949134723a7521527e2810c3adafab69f4408"
    },
    {
      "captureId": "lpoint-terms",
      "sourceUrl": "https://members.lpoint.com/resources/html/privacy/iframe_1009_C0_ko.html",
      "affiliate": "Lotte Members (L.POINT)",
      "businessGroup": "loyalty_membership",
      "captureDate": "2026-09-29",
      "policyVersionOrEffectiveDate": "2012년 2월 22일부터 시행 ; 2012년 2월 22일 개정 ; 2013년 5월 1일부터 시행 ; 2013년 5월 1일 개정",
      "contentHash": "11203ef1de8f0d33430f958a1facaa7ae39be78bd5a0d86c8ad2abaf952021bb"
    }
  ]
}
