{
  "id": "lotte.privacy.S14.retail_ecommerce.01",
  "docType": "privacy",
  "sectionId": "S14",
  "domainGroup": "retail_ecommerce",
  "sourceCaptureIds": [
    "lotte-department-store-privacy",
    "lotte-mart-privacy",
    "seven-eleven-privacy",
    "lotte-himart-mall-privacy"
  ],
  "sourceSites": [
    "www.lotteshopping.com",
    "company.lottemart.com",
    "www.7-eleven.co.kr",
    "www.e-himart.co.kr"
  ],
  "policyVersionOrDate": "2026년 07월 22일부터 적용 / 시행일자 : 2026-07-09 / 공고일자 : 2010년 12월 03일 / 2026.07.10부터 적용",
  "layout": "guideline_numbered",
  "text": "회사는 서비스 이용 과정에서 정보주체에게 최적화된 맞춤형 서비스와 혜택을 제공하기 위하여 행태정보를 수집·이용합니다.\n{%if gate.behavioralIdentified%}\n가. 수집하는 행태정보의 항목, 수집 방법, 수집 목적, 보유·이용기간 및 이용자의 거부 방법\n\n{{behavioralTable}}\n나. 행태정보 수집 방법\n- 서비스 이용 과정에서 자동으로 수집되며, 온라인 광고나 맞춤형 콘텐츠 제공을 위해 사용될 수 있습니다.\n다. 행태정보 수집 및 맞춤형 서비스 거부 방법\n- 앱 또는 웹의 설정 메뉴에서 맞춤형 서비스 및 행태정보 수집을 거부할 수 있습니다.\n- 브라우저 설정으로 쿠키 저장을 거부할 수 있습니다.\n{%endif%}\n{%if gate.behavioralNonIdentified%}\n회사는 정보주체를 식별하지 않는 상태의 행태정보를 다음과 같이 처리합니다. {{behavioralTable}}\n{%endif%}\n{%if gate.thirdPartyTrackers%}\n회사는 제3자가 행태정보를 수집하도록 허용하는 경우 그 사실을 아래 절에서 별도로 알립니다.\n{%endif%}\n회사는 만 14세 미만 아동으로 확인되는 이용자의 행태정보를 수집하지 않고, 민감정보를 추론할 수 있는 행태정보를 생성하지 않습니다.",
  "variables": [
    {
      "name": "behavioralTable",
      "slotId": "privacy.S14_behavioral",
      "description": "Behavioral information items, purposes, collection methods, retention"
    }
  ],
  "conditions": [
    {
      "slot": "gate.behavioralIdentified",
      "op": "truthy"
    }
  ],
  "coversElements": [
    "R-S14-003",
    "R-S14-004",
    "R-S14-005",
    "R-S14-006"
  ],
  "gapsVsGuideline": [
    {
      "ruleId": "R-S14-007",
      "level": "must",
      "note": "제3자 사이트 수집 안내는 별도 절(S15) 필요."
    }
  ],
  "vetted": false,
  "vettingNotes": "온라인 맞춤형 광고 개인정보 보호 가이드라인 문구가 반영되어 있어 C2 인용 검증 대상.",
  "frequency": 4,
  "frequencyBase": 5,
  "houseStyleTags": [
    "H-15"
  ],
  "provenance": [
    {
      "captureId": "lotte-department-store-privacy",
      "sourceUrl": "https://www.lotteshopping.com/etc/personalinfo",
      "affiliate": "Lotte Department Store",
      "businessGroup": "retail_ecommerce",
      "captureDate": "2026-09-29",
      "policyVersionOrEffectiveDate": "2026년 07월 22일부터 적용 ; v19.9 ; V19.8 ; V19.9",
      "contentHash": "a859427af048dabf825212295551607baaa748b71da215390d0194ffcf34fbb0"
    },
    {
      "captureId": "lotte-mart-privacy",
      "sourceUrl": "https://company.lottemart.com/privacy/privacy.asp",
      "affiliate": "Lotte Mart",
      "businessGroup": "retail_ecommerce",
      "captureDate": "2026-09-29",
      "policyVersionOrEffectiveDate": "시행일자 : 2026-07-09 ; 2026년 7월 9일부터 적용 ; V13.5 ; V13.4",
      "contentHash": "590a26db8498b8c4c8e6207f1d0ae882474ee75a92941b51e9a6ef52435f4d4d"
    },
    {
      "captureId": "seven-eleven-privacy",
      "sourceUrl": "https://www.7-eleven.co.kr/util/policyPrivacy.asp",
      "affiliate": "Korea Seven (7-Eleven)",
      "businessGroup": "retail_ecommerce",
      "captureDate": "2026-09-29",
      "policyVersionOrEffectiveDate": "공고일자 : 2010년 12월 03일 ; 개정일자 : 2026년 07월 08일 ; 시행일자 : 2026년 07월 15일 ; 2026년 07월 15일 시행",
      "contentHash": "6af655aff980d52c4d64c8ebea85ef5d24994e94e40fdd6bd45bb3ee912cd2f0"
    },
    {
      "captureId": "lotte-himart-mall-privacy",
      "sourceUrl": "https://www.e-himart.co.kr/app/terms/privacy?stonType=PC",
      "affiliate": "Lotte Himart",
      "businessGroup": "retail_ecommerce",
      "captureDate": "2026-09-29",
      "policyVersionOrEffectiveDate": "2026.07.10부터 적용 ; VER 9.6 ; VER 9.5 ; VER 9.4",
      "contentHash": "df3adf5a2e5bbb423c88ecf061c24e22d7647dc3a22eb6a5e468e6ad54c2b3b7"
    }
  ]
}
