{
  "id": "lotte.privacy.S03.cross_group.01",
  "docType": "privacy",
  "sectionId": "S03",
  "domainGroup": "cross_group",
  "sourceCaptureIds": [
    "lotteinnovate-privacy",
    "lotte-mart-privacy",
    "lotte-castle-privacy",
    "lotte-global-logis-privacy",
    "lotte-wellfood-privacy"
  ],
  "sourceSites": [
    "www.lotteinnovate.com",
    "company.lottemart.com",
    "www.lottecastle.co.kr",
    "www.lotteglogis.com",
    "www.lottewellfood.com"
  ],
  "policyVersionOrDate": "공고일자 : 2026년 6월 25일 / 시행일자 : 2026-07-09 / 시행일자 : 2026년 07월 16일 / v3.9",
  "layout": "guideline_numbered",
  "text": "회사는 「개인정보 보호법」에 따라 서비스 제공에 필요한 최소한의 범위에서 개인정보를 수집·이용합니다.\n\n가. 정보주체의 동의를 받지 않고 처리하는 개인정보 항목\n회사는 다음의 개인정보 항목을 정보주체의 동의 없이 처리하고 있습니다.\n(표) 법적 근거 / 구분 / 수집 목적 / 수집 항목 / 보유 및 이용기간\n\n나. 정보주체의 동의를 받아 처리하는 개인정보 항목\n회사는 다음의 개인정보 항목을 정보주체의 동의를 받아 처리하고 있습니다.\n(표) 법적 근거 / 구분 / 수집 목적 / 수집 항목 / 보유 및 이용기간\n\n{{itemsTable}}",
  "variables": [
    {
      "name": "itemsTable",
      "slotId": "privacy.S03_items",
      "description": "Items per purpose with legal basis and retention, rendered as tables"
    }
  ],
  "conditions": [],
  "coversElements": [
    "R-S03-001",
    "R-S03-003",
    "R-S03-004"
  ],
  "gapsVsGuideline": [
    {
      "ruleId": "R-S03-002",
      "level": "must",
      "note": "항목을 '등'으로 줄이지 않도록 슬롯 값 점검 필요."
    }
  ],
  "vetted": false,
  "vettingNotes": "Not vetted. Awaiting privacy-domain-expert review against the current rule pack.",
  "frequency": 5,
  "frequencyBase": 15,
  "houseStyleTags": [
    "H-06"
  ],
  "provenance": [
    {
      "captureId": "lotteinnovate-privacy",
      "sourceUrl": "https://www.lotteinnovate.com/ko/tos/privacyPolicy",
      "affiliate": "Lotte Innovate",
      "businessGroup": "it_services",
      "captureDate": "2026-09-29",
      "policyVersionOrEffectiveDate": "공고일자 : 2026년 6월 25일 ; 시행일자 : 2026년 6월 25일 ; 공고일자 : 2025년 9월 18일 ; 시행일자 : 2025년 9월 18일",
      "contentHash": "ed631cda902e7824593df708a5399a8fe8e4516efd4252d5cb9ce0f65f4f7b7d"
    },
    {
      "captureId": "lotte-mart-privacy",
      "sourceUrl": "https://company.lottemart.com/privacy/privacy.asp",
      "affiliate": "Lotte Mart",
      "businessGroup": "retail_ecommerce",
      "captureDate": "2026-09-29",
      "policyVersionOrEffectiveDate": "시행일자 : 2026-07-09 ; 2026년 7월 9일부터 적용 ; V13.5 ; V13.4",
      "contentHash": "590a26db8498b8c4c8e6207f1d0ae882474ee75a92941b51e9a6ef52435f4d4d"
    },
    {
      "captureId": "lotte-castle-privacy",
      "sourceUrl": "https://www.lottecastle.co.kr/privacy/index.do",
      "affiliate": "Lotte E&C (Lotte Castle brand)",
      "businessGroup": "construction_realestate",
      "captureDate": "2026-09-29",
      "policyVersionOrEffectiveDate": "시행일자 : 2026년 07월 16일 ; 공고일자 : 2026년 07월 09일 ; 2026년 07월 16일 시행 ; 2026년 05월 13일 시행",
      "contentHash": "d346946e83f4c4b1d279675daad519db2fef800cd78ba1dc456630f88daa2bde"
    },
    {
      "captureId": "lotte-global-logis-privacy",
      "sourceUrl": "https://www.lotteglogis.com/home/policy/privacy",
      "affiliate": "Lotte Global Logistics",
      "businessGroup": "logistics",
      "captureDate": "2026-09-29",
      "policyVersionOrEffectiveDate": "v3.9 ; v3.8 ; v3.7 ; v3.6",
      "contentHash": "410069f0b4dfeea3eac1b789a4a0b07900230a4fbfafecb6ae19f2c3f2fe8114"
    },
    {
      "captureId": "lotte-wellfood-privacy",
      "sourceUrl": "https://www.lottewellfood.com/policy/privacy",
      "affiliate": "Lotte Wellfood",
      "businessGroup": "food_manufacturing",
      "captureDate": "2026-09-29",
      "policyVersionOrEffectiveDate": "시행일자: 2026년 8월 10일 ; v.2.22 ; v.2.21 ; v.2.20",
      "contentHash": "072b5887741bb5bb109ac2c6d576162ef430c18da9c328d1f8a3d22cd4d8aa94"
    }
  ]
}
