{
  "id": "lotte.terms.T12.cross_group.01",
  "docType": "terms",
  "sectionId": "T12",
  "domainGroup": "cross_group",
  "sourceCaptureIds": [
    "lotte-mart-terms",
    "lotte-himart-terms",
    "lotte-rental-terms",
    "lotte-wellfood-terms",
    "lotte-chilsung-terms",
    "lpoint-terms-members-portal"
  ],
  "sourceSites": [
    "company.lottemart.com",
    "company.himart.co.kr",
    "www.lotterentacar.net",
    "www.lottewellfood.com",
    "company.lottechilsung.co.kr",
    "members.lpoint.com"
  ],
  "policyVersionOrDate": "2025년 10월 1일부터 적용 / 2025.08.29부터 적용 / 시행일자 : 2020/01/16 / 2015년 4월 20일부터 시행",
  "layout": "legacy_article",
  "text": "제N조 (저작권의 귀속 및 이용제한)\n1. 회사가 작성한 저작물에 대한 저작권 및 기타 지식재산권은 회사에 귀속합니다.\n2. 이용자는 서비스를 이용함으로써 얻은 정보 중 회사에게 지식재산권이 귀속된 정보를 회사의 사전 승낙 없이 복제, 송신, 출판, 배포, 방송 기타 방법에 의하여 영리 목적으로 이용하거나 제3자에게 이용하게 하여서는 안 됩니다.\n3. 회사는 약정에 따라 이용자에게 귀속된 저작권을 사용하는 경우 당해 이용자에게 통보하여야 합니다.\n{%if terms.ugc%}\n4. 이용자가 서비스 내에 게시한 게시물의 저작권은 해당 이용자에게 귀속됩니다. 회사는 서비스 운영·홍보 목적의 범위에서만 이를 이용할 수 있으며, {{ipPolicy}}에 따라 게시 중단 요청이 있는 경우 지체 없이 처리합니다.\n{%endif%}",
  "variables": [
    {
      "name": "ipPolicy",
      "slotId": "terms.ipPolicy",
      "description": "Copyright and posting rules"
    }
  ],
  "conditions": [
    {
      "slot": "terms.applicable",
      "op": "truthy"
    }
  ],
  "coversElements": [
    "R-T12-001",
    "R-T12-002",
    "R-T12-003"
  ],
  "gapsVsGuideline": [
    {
      "ruleId": "R-T12-004",
      "level": "should",
      "note": "게시 중단 절차는 UGC 사용 시에만 필요."
    }
  ],
  "vetted": false,
  "vettingNotes": "Not vetted. Awaiting privacy-domain-expert review against the current rule pack.",
  "frequency": 6,
  "frequencyBase": 13,
  "houseStyleTags": [],
  "provenance": [
    {
      "captureId": "lotte-mart-terms",
      "sourceUrl": "https://company.lottemart.com/privacy/term.asp",
      "affiliate": "Lotte Mart",
      "businessGroup": "retail_ecommerce",
      "captureDate": "2026-09-29",
      "policyVersionOrEffectiveDate": "2025년 10월 1일부터 적용 ; 2025년 5월 29일부터 적용",
      "contentHash": "5ac1c0c774222ff77be14ea0dff78529b128683e67b2095cb40543a80246eaed"
    },
    {
      "captureId": "lotte-himart-terms",
      "sourceUrl": "https://company.himart.co.kr/policy/terms",
      "affiliate": "Lotte Himart",
      "businessGroup": "retail_ecommerce",
      "captureDate": "2026-09-29",
      "policyVersionOrEffectiveDate": "2025.08.29부터 적용",
      "contentHash": "59e7cc599d744e3fda2d9afad802786922cbd67b51afa876bf2f615a625db01f"
    },
    {
      "captureId": "lotte-rental-terms",
      "sourceUrl": "https://www.lotterentacar.net/kor/footer/footerTermsNew.do?mnCd=MK0903",
      "affiliate": "Lotte Rental",
      "businessGroup": "services_leisure",
      "captureDate": "2026-09-29",
      "policyVersionOrEffectiveDate": "시행일자 : 2020/01/16 ; 2020년 1월 16일부터 시행",
      "contentHash": "53373e281b85b33a258cd270a4541695a574adb432e972f917c03c87daee5600"
    },
    {
      "captureId": "lotte-wellfood-terms",
      "sourceUrl": "https://www.lottewellfood.com/policy/use",
      "affiliate": "Lotte Wellfood",
      "businessGroup": "food_manufacturing",
      "captureDate": "2026-09-29",
      "policyVersionOrEffectiveDate": "2015년 4월 20일부터 시행",
      "contentHash": "27c92d094aaa5850a438e3164fbdad5b21326d87f3fff9ac3ad9e1a05889ecbf"
    },
    {
      "captureId": "lotte-chilsung-terms",
      "sourceUrl": "https://company.lottechilsung.co.kr/kor/util/terms/contentsid/567/index.do",
      "affiliate": "Lotte Chilsung Beverage",
      "businessGroup": "food_manufacturing",
      "captureDate": "2026-09-29",
      "policyVersionOrEffectiveDate": "2015년 04월 20일부터 시행",
      "contentHash": "0042aa51bf8696d3c2ea0c3ddc8949134723a7521527e2810c3adafab69f4408"
    },
    {
      "captureId": "lpoint-terms-members-portal",
      "sourceUrl": "https://members.lpoint.com/resources/html/privacy/iframe_1000_C1_ko.html",
      "affiliate": "Lotte Members (L.POINT)",
      "businessGroup": "loyalty_membership",
      "captureDate": "2026-09-29",
      "policyVersionOrEffectiveDate": "2020년 04월 28일부터 시행 ; 2020.04.28 개정 ; 2020년 08월 18일부터 시행 ; 2020년 11월 19일부터 시행",
      "contentHash": "82d05f33b2100a3b70b65012ece5ed78b41c3041579ee075b8fc9f93d634ece8"
    }
  ]
}
